{
  "albums": [
    {
      "artistDisplay": "ミナト",
      "artistIds": [
        "fixture:ar:ar01"
      ],
      "artworkUrl": "fixtures/art/al01.svg",
      "id": "fixture:al:al01",
      "latinSource": null,
      "releaseDate": "2024-03-01",
      "title": "夜明けのメロディ - Single",
      "titleLatin": null,
      "type": "single"
    },
    {
      "artistDisplay": "ミナト",
      "artistIds": [
        "fixture:ar:ar01"
      ],
      "artworkUrl": "fixtures/art/al02.svg",
      "id": "fixture:al:al02",
      "latinSource": null,
      "releaseDate": "2024-11-20",
      "title": "Dawn Collection",
      "titleLatin": null,
      "type": "album"
    },
    {
      "artistDisplay": "夜風シアター & 青井ユウ",
      "artistIds": [
        "fixture:ar:ar02",
        "fixture:ar:ar07"
      ],
      "artworkUrl": "fixtures/art/al05.svg",
      "id": "fixture:al:al05",
      "latinSource": null,
      "releaseDate": "2025-02-14",
      "title": "ふたりの約束 - Single",
      "titleLatin": null,
      "type": "single"
    },
    {
      "artistDisplay": "月見坂46",
      "artistIds": [
        "fixture:ar:ar10"
      ],
      "artworkUrl": "fixtures/art/al06.svg",
      "id": "fixture:al:al06",
      "latinSource": null,
      "releaseDate": "2025-08-27",
      "title": "坂道の向こう - Single",
      "titleLatin": null,
      "type": "single"
    },
    {
      "artistDisplay": "ヴィオラ・ノート",
      "artistIds": [
        "fixture:ar:ar09"
      ],
      "artworkUrl": "fixtures/art/al07.svg",
      "id": "fixture:al:al07",
      "latinSource": null,
      "releaseDate": "2026-09-30",
      "title": "秋風のワルツ - Single",
      "titleLatin": null,
      "type": "single"
    },
    {
      "artistDisplay": "さくらんぼ組",
      "artistIds": [
        "fixture:ar:ar04"
      ],
      "artworkUrl": "fixtures/art/al08.svg",
      "id": "fixture:al:al08",
      "latinSource": null,
      "releaseDate": "2026-07-20",
      "title": "なつやすみ - Single",
      "titleLatin": null,
      "type": "single"
    },
    {
      "artistDisplay": "KOTONOHA",
      "artistIds": [
        "fixture:ar:ar08"
      ],
      "artworkUrl": "fixtures/art/al09-v2.svg",
      "id": "fixture:al:al09",
      "latinSource": null,
      "releaseDate": "2026-05-13",
      "title": "透明なシグナル - Single",
      "titleLatin": null,
      "type": "single"
    },
    {
      "artistDisplay": "Re:Pulse",
      "artistIds": [
        "fixture:ar:ar11"
      ],
      "artworkUrl": "fixtures/art/al10.svg",
      "id": "fixture:al:al10",
      "latinSource": null,
      "releaseDate": "2025-10-10",
      "title": "RIOT",
      "titleLatin": null,
      "type": "ep"
    },
    {
      "artistDisplay": "ヴィオラ・ノート",
      "artistIds": [
        "fixture:ar:ar09"
      ],
      "artworkUrl": "fixtures/art/al13.svg",
      "id": "fixture:al:al13",
      "latinSource": null,
      "releaseDate": "2021-06-02",
      "title": "雨音のソナタ",
      "titleLatin": null,
      "type": "album"
    },
    {
      "artistDisplay": "青井ユウ",
      "artistIds": [
        "fixture:ar:ar07"
      ],
      "artworkUrl": "fixtures/art/al14.svg",
      "id": "fixture:al:al14",
      "latinSource": null,
      "releaseDate": "2026-03-04",
      "title": "Blue Diary",
      "titleLatin": null,
      "type": "album"
    },
    {
      "artistDisplay": "ｶﾞﾗｽﾉﾈｺ",
      "artistIds": [
        "fixture:ar:ar05"
      ],
      "artworkUrl": "fixtures/art/al15.svg",
      "id": "fixture:al:al15",
      "latinSource": null,
      "releaseDate": "2023-11-22",
      "title": "猫の目",
      "titleLatin": null,
      "type": "album"
    },
    {
      "artistDisplay": "ＬＵＭＩＮＡ",
      "artistIds": [
        "fixture:ar:ar03"
      ],
      "artworkUrl": "fixtures/art/al16.svg",
      "id": "fixture:al:al16",
      "latinSource": null,
      "releaseDate": "2026-01-21",
      "title": "Prism",
      "titleLatin": null,
      "type": "ep"
    },
    {
      "artistDisplay": "さくらんぼ組",
      "artistIds": [
        "fixture:ar:ar04"
      ],
      "artworkUrl": "fixtures/art/al17.svg",
      "id": "fixture:al:al17",
      "latinSource": null,
      "releaseDate": "2025-12-03",
      "title": "星に願いを♪ - Single",
      "titleLatin": null,
      "type": "single"
    },
    {
      "artistDisplay": "月見坂46",
      "artistIds": [
        "fixture:ar:ar10"
      ],
      "artworkUrl": "fixtures/art/al18.svg",
      "id": "fixture:al:al18",
      "latinSource": null,
      "releaseDate": "2026-06-18",
      "title": "①番星 - Single",
      "titleLatin": null,
      "type": "single"
    },
    {
      "artistDisplay": "Hoshizora Drive",
      "artistIds": [
        "fixture:ar:ar06"
      ],
      "artworkUrl": "fixtures/art/al19.svg",
      "id": "fixture:al:al19",
      "latinSource": null,
      "releaseDate": "2019-08-30",
      "title": "Midnight Drive - Single",
      "titleLatin": null,
      "type": "single"
    },
    {
      "artistDisplay": "東京ノイズ",
      "artistIds": [
        "fixture:ar:ar13"
      ],
      "artworkUrl": "fixtures/art/al20.svg",
      "id": "fixture:al:al20",
      "latinSource": null,
      "releaseDate": "2024-07-07",
      "title": "東京ライツ - Single",
      "titleLatin": null,
      "type": "single"
    },
    {
      "artistDisplay": "夜風シアター",
      "artistIds": [
        "fixture:ar:ar02"
      ],
      "artworkUrl": "fixtures/art/al21.svg",
      "id": "fixture:al:al21",
      "latinSource": null,
      "releaseDate": "2025-05-21",
      "title": "夜風劇場",
      "titleLatin": null,
      "type": "album"
    },
    {
      "artistDisplay": "KOTONOHA",
      "artistIds": [
        "fixture:ar:ar08"
      ],
      "artworkUrl": "fixtures/art/al22.svg",
      "id": "fixture:al:al22",
      "latinSource": null,
      "releaseDate": "2025-09-12",
      "title": "Stay (Forever) - Single",
      "titleLatin": null,
      "type": "single"
    },
    {
      "artistDisplay": "ＬＵＭＩＮＡ",
      "artistIds": [
        "fixture:ar:ar03"
      ],
      "artworkUrl": "fixtures/art/al24.svg",
      "id": "fixture:al:al24",
      "latinSource": null,
      "releaseDate": "2026-08-05",
      "title": "ガラス越しの光 - Single",
      "titleLatin": null,
      "type": "single"
    },
    {
      "artistDisplay": "ｶﾞﾗｽﾉﾈｺ",
      "artistIds": [
        "fixture:ar:ar05"
      ],
      "artworkUrl": "fixtures/art/al25.svg",
      "id": "fixture:al:al25",
      "latinSource": null,
      "releaseDate": "2020-02-26",
      "title": "猫背のブルース - Single",
      "titleLatin": null,
      "type": "single"
    },
    {
      "artistDisplay": "KOTONOHA",
      "artistIds": [
        "fixture:ar:ar08"
      ],
      "artworkUrl": "fixtures/art/al26.svg",
      "id": "fixture:al:al26",
      "latinSource": null,
      "releaseDate": "2026-09-09",
      "title": "メモリーレーン - Single",
      "titleLatin": null,
      "type": "single"
    },
    {
      "artistDisplay": "月見坂46",
      "artistIds": [
        "fixture:ar:ar10"
      ],
      "artworkUrl": "fixtures/art/al27.svg",
      "id": "fixture:al:al27",
      "latinSource": null,
      "releaseDate": "2026-03-18",
      "title": "制服とサイダー - Single",
      "titleLatin": null,
      "type": "single"
    },
    {
      "artistDisplay": "Re:Pulse",
      "artistIds": [
        "fixture:ar:ar11"
      ],
      "artworkUrl": "fixtures/art/al28.svg",
      "id": "fixture:al:al28",
      "latinSource": null,
      "releaseDate": "2026-06-03",
      "title": "ゼロ距離Love - Single",
      "titleLatin": null,
      "type": "single"
    },
    {
      "artistDisplay": "ぱぴぷ楽団",
      "artistIds": [
        "fixture:ar:ar12"
      ],
      "artworkUrl": "fixtures/art/al29.svg",
      "id": "fixture:al:al29",
      "latinSource": null,
      "releaseDate": "2024-10-16",
      "title": "おやつの時間",
      "titleLatin": null,
      "type": "album"
    },
    {
      "artistDisplay": "夜風シアター",
      "artistIds": [
        "fixture:ar:ar02"
      ],
      "artworkUrl": "fixtures/art/al30.svg",
      "id": "fixture:al:al30",
      "latinSource": null,
      "releaseDate": "2025-11-05",
      "title": "真夜中の観覧車 - Single",
      "titleLatin": null,
      "type": "single"
    },
    {
      "artistDisplay": "東京ノイズ",
      "artistIds": [
        "fixture:ar:ar13"
      ],
      "artworkUrl": "fixtures/art/al31.svg",
      "id": "fixture:al:al31",
      "latinSource": null,
      "releaseDate": "2026-08-19",
      "title": "Shibuya 24時 - Single",
      "titleLatin": null,
      "type": "single"
    },
    {
      "artistDisplay": "ナナ",
      "artistIds": [
        "fixture:ar:ar14"
      ],
      "artworkUrl": "fixtures/art/al32.svg",
      "id": "fixture:al:al32",
      "latinSource": null,
      "releaseDate": "2026-09-16",
      "title": "ハローグッバイ - Single",
      "titleLatin": null,
      "type": "single"
    },
    {
      "artistDisplay": "Hoshizora Drive",
      "artistIds": [
        "fixture:ar:ar06"
      ],
      "artworkUrl": "fixtures/art/al33.svg",
      "id": "fixture:al:al33",
      "latinSource": null,
      "releaseDate": "2026-07-01",
      "title": "流星Highway",
      "titleLatin": null,
      "type": "ep"
    }
  ],
  "artists": [
    {
      "id": "fixture:ar:ar01",
      "latinSource": "provider",
      "name": "ミナト",
      "nameLatin": "Minato"
    },
    {
      "id": "fixture:ar:ar02",
      "latinSource": "provider",
      "name": "夜風シアター",
      "nameLatin": "Yokaze Theater"
    },
    {
      "id": "fixture:ar:ar03",
      "latinSource": null,
      "name": "ＬＵＭＩＮＡ",
      "nameLatin": null
    },
    {
      "id": "fixture:ar:ar04",
      "latinSource": "provider",
      "name": "さくらんぼ組",
      "nameLatin": "Sakuranbo-gumi"
    },
    {
      "id": "fixture:ar:ar05",
      "latinSource": "provider",
      "name": "ｶﾞﾗｽﾉﾈｺ",
      "nameLatin": "Garasu no Neko"
    },
    {
      "id": "fixture:ar:ar06",
      "latinSource": null,
      "name": "Hoshizora Drive",
      "nameLatin": null
    },
    {
      "id": "fixture:ar:ar07",
      "latinSource": "provider",
      "name": "青井ユウ",
      "nameLatin": "Aoi Yuu"
    },
    {